{
    "schema_version":  1,
    "content_kind":  "battle",
    "combatants":  [
                       {
                           "id":  "player.simon",
                           "team":  "players",
                           "name":  "Simon",
                           "abilities":  [
                                             "ability.simon.0",
                                             "ability.simon.1",
                                             "ability.simon.2",
                                             "ability.simon.3"
                                         ],
                           "attributes":  {
                                              "maximum_health":  25,
                                              "damage_minimum":  5,
                                              "damage_maximum":  8,
                                              "armour":  1,
                                              "critical_hit_chance":  6,
                                              "dodge":  3,
                                              "initiative":  1,
                                              "precision":  6
                                          },
                           "resistances":  {
                                               "sleep":  0,
                                               "confusion":  0,
                                               "debuff":  0,
                                               "decay":  0
                                           }
                       },
                       {
                           "id":  "player.ole",
                           "team":  "players",
                           "name":  "Ole",
                           "abilities":  [
                                             "ability.ole.0",
                                             "ability.ole.1",
                                             "ability.ole.2",
                                             "ability.ole.3"
                                         ],
                           "attributes":  {
                                              "maximum_health":  20,
                                              "damage_minimum":  5,
                                              "damage_maximum":  8,
                                              "armour":  1,
                                              "critical_hit_chance":  6,
                                              "dodge":  6,
                                              "initiative":  2,
                                              "precision":  6
                                          },
                           "resistances":  {
                                               "sleep":  0,
                                               "confusion":  0,
                                               "debuff":  0,
                                               "decay":  0
                                           }
                       },
                       {
                           "id":  "player.anna",
                           "team":  "players",
                           "name":  "Anna",
                           "abilities":  [
                                             "ability.anna.0",
                                             "ability.anna.1",
                                             "ability.anna.2",
                                             "ability.anna.3"
                                         ],
                           "attributes":  {
                                              "maximum_health":  20,
                                              "damage_minimum":  5,
                                              "damage_maximum":  8,
                                              "armour":  1,
                                              "critical_hit_chance":  5,
                                              "dodge":  9,
                                              "initiative":  3,
                                              "precision":  5
                                          },
                           "resistances":  {
                                               "sleep":  0,
                                               "confusion":  0,
                                               "debuff":  0,
                                               "decay":  0
                                           }
                       },
                       {
                           "id":  "player.markus",
                           "team":  "players",
                           "name":  "Markus",
                           "marks_attackers_for_revenge":  true,
                           "abilities":  [
                                             "ability.markus.0",
                                             "ability.markus.1",
                                             "ability.markus.2",
                                             "ability.markus.3"
                                         ],
                           "attributes":  {
                                              "maximum_health":  30,
                                              "damage_minimum":  9,
                                              "damage_maximum":  12,
                                              "armour":  1,
                                              "critical_hit_chance":  4,
                                              "dodge":  3,
                                              "initiative":  1,
                                              "precision":  4
                                          },
                           "resistances":  {
                                               "sleep":  0,
                                               "confusion":  0,
                                               "debuff":  0,
                                               "decay":  0
                                           }
                       },
                       {
                           "id":  "enemy.gesetzloser",
                           "ai_policy":  "miss_shooter",
                           "team":  "enemies",
                           "encounter_cost":  2,
                           "name":  "Gesetzloser",
                           "abilities":  [
                                             "ability.enemy.springfield",
                                             "ability.enemy.miss"
                                         ],
                           "attributes":  {
                                              "maximum_health":  20,
                                              "damage_minimum":  7,
                                              "damage_maximum":  10,
                                              "armour":  1,
                                              "critical_hit_chance":  5,
                                              "dodge":  3,
                                              "initiative":  1,
                                              "precision":  5
                                          },
                           "resistances":  {
                                               "sleep":  0,
                                               "confusion":  0,
                                               "debuff":  0,
                                               "decay":  0
                                           }
                       },
                       {
                           "id":  "enemy.abtruenniger",
                           "ai_policy":  "fanning",
                           "team":  "enemies",
                           "encounter_cost":  1,
                           "name":  "Abtrünniger",
                           "abilities":  [
                                             "ability.enemy.bang",
                                             "ability.enemy.fanning"
                                         ],
                           "attributes":  {
                                              "maximum_health":  20,
                                              "damage_minimum":  5,
                                              "damage_maximum":  8,
                                              "armour":  1,
                                              "critical_hit_chance":  5,
                                              "dodge":  3,
                                              "initiative":  1,
                                              "precision":  5
                                          },
                           "resistances":  {
                                               "sleep":  0,
                                               "confusion":  0,
                                               "debuff":  0,
                                               "decay":  0
                                           }
                       },
                       {
                           "id":  "enemy.indianer",
                           "ai_policy":  "sleep",
                           "team":  "enemies",
                           "encounter_cost":  1,
                           "name":  "Indianer",
                           "abilities":  [
                                             "ability.enemy.tomahawk",
                                             "ability.enemy.knock_out"
                                         ],
                           "attributes":  {
                                              "maximum_health":  20,
                                              "damage_minimum":  3,
                                              "damage_maximum":  5,
                                              "armour":  1,
                                              "critical_hit_chance":  5,
                                              "dodge":  8,